Complaint_Slug,Dx_ID,Rule_ID,Logic,Points,Pack_Version,Notes
psych_depression_suicidal_ideation,CL_PDEP_MAJOR_DEPRESSION,NEG_MD_SI,"answers.Q_PDEP_SI == 'yes'",-6,v1,Suppress major depression when SI present
psych_depression_suicidal_ideation,CL_PDEP_SUICIDE_RISK,BOOST_SR_SI,"answers.Q_PDEP_SI == 'yes'",2,v1,Boost suicide risk with SI
psych_depression_suicidal_ideation,CL_PDEP_SUICIDE_RISK,BOOST_SR_INTENT,"answers.Q_PDEP_INTENT == 'yes'",3,v1,Boost suicide risk with intent
psych_depression_suicidal_ideation,CL_PDEP_PSYCHOTIC_DEPRESSION,BOOST_PD_PSYCHOSIS,"answers.Q_PDEP_PSYCHOSIS == 'yes'",3,v1,Boost psychotic depression with psychosis
psych_depression_suicidal_ideation,CL_PDEP_MAJOR_DEPRESSION,NEG_MD_PSYCHOSIS,"answers.Q_PDEP_PSYCHOSIS == 'yes'",-5,v1,Suppress major depression with psychosis
psych_depression_suicidal_ideation,CL_PDEP_SUBSTANCE_RELATED,BOOST_SUB_SI_SUBSTANCE,"answers.Q_PDEP_SI == 'yes' && answers.Q_PDEP_SUBSTANCE == 'yes'",2,v1,Boost substance related with SI + substance
