Diagnosis ID,System,Chief Complaint,Diagnosis,Cluster,Subcluster,Mechanism / Etiology,Severity Level,Diagnostic Criteria,Red Flag?,Red Flag Criteria,Key Modifiers,Secondary Questions,Exam Findings,Testing – Imaging,Testing – Labs,Disposition,Disposition Rationale,Default Triage Route,ER Threshold,UC Threshold,PC Threshold,Follow-up Plan,Treatment – First Line,Treatment – Alternatives,Supportive Care,Pediatric Variant,Modifier Rule,Cluster Link,Medication Link,Logic Notes,Dx_Key
DERM_HAIR_TEL_01,DERM,HAIR_LOSS,Telogen effluvium (stress/illness/postpartum),Hair loss,Diffuse shedding,Shift to shedding phase,Low,Diffuse shedding after stress/illness/postpartum,N,,postpartum,Timeline triggers,Normal scalp,,"TSH/ferritin/CBC optional",PC,Often self-limited,PC,,"UC if systemic red flags",PC,Reassess 3–6 months,"",,Nutrition/sleep,Yes,,"",Derm hair cluster,,"Rule out iron/thyroid",DERM_HAIR_TEL
DERM_HAIR_AA_01,DERM,HAIR_LOSS,Alopecia areata,Hair loss,Patches,Autoimmune,Moderate,Patches of hair loss,N,,autoimmune,Patch onset,Smooth patches,,"",PC,Outpatient derm,PC,,"UC if rapid systemic",PC,Derm follow-up,"",,Supportive,Yes,,"",Derm hair cluster,,"Consider thyroid association",DERM_HAIR_AA
DERM_HAIR_SCARRING_01,DERM,HAIR_LOSS,Scarring alopecia concern,Hair loss,Red flags,Inflammatory scarring,High,Scalp pain/burning + redness/scarring,Y,"Scalp pain + inflammation + scarring signs",immunocompromised,Progression,Scarring,,"",UC/ED,Needs urgent derm eval,ED,"UC urgent",UC,,Urgent referral,"",,Supportive,No,,"",Derm hair red flags,"ROW_KEY=DERM_HAIR_SCARRING_01|UrgentEval","Prevent permanent loss",DERM_HAIR_SCARRING
NUT_WM_GLP1_OK_01,NUTRITION,WEIGHT_MANAGEMENT,Weight management (lifestyle first),Nutrition,Weight,Behavioral,Moderate,Weight goal without red flags,N,,,"Goals, tracking",Normal,,"",PC/UC,Outpatient,PC,,"UC if complex",PC,Follow-up,,"",Protein/fiber focus,No,,"",Nutrition cluster,,"Screen ED risk",NUT_WM_LIFESTYLE
NUT_WM_GLP1_CONTRA_01,NUTRITION,WEIGHT_MANAGEMENT,GLP-1 contraindication risk,Nutrition,Weight,Medication safety,High,MEN2/MTC history or pregnancy or pancreatitis hx,Y,"MTC/MEN2, pregnancy, pancreatitis history",pregnancy,History review,Normal,,"",PC/UC,Avoid GLP-1; alternate plan,PC,,"UC if symptoms",PC,Follow-up,,"",Supportive,No,,"",Nutrition red flags,"ROW_KEY=NUT_WM_GLP1_CONTRA_01|ClinicianEval","Do not prescribe if contraindicated",NUT_WM_GLP1_CONTRA
NUT_BARI_DEF_01,NUTRITION,POST_BARIATRIC,Post-bariatric deficiency risk,Nutrition,Bariatric,Malabsorption/intake,Moderate,Fatigue/hair loss/paresthesia + poor supplementation,N,,post_bariatric_surgery,Supplements adherence,Normal,,"B12/iron/Vit D as indicated",PC/UC,Needs labs & supplement plan,PC,,"UC if severe",PC,Bariatric follow-up,"",,Protein/vitamins,No,,"",Nutrition bariatric cluster,,"Avoid NSAIDs esp RYGB",NUT_BARI_DEF
NUT_BARI_RED_01,NUTRITION,POST_BARIATRIC,Post-bariatric complication red flags,Nutrition,Bariatric,Dehydration/obstruction,High,Severe vomiting + severe abd pain + dehydration,Y,"Cannot keep fluids down, severe pain, syncope",,Vomiting,Dehydrated,,"",ED,Life-threatening complications possible,ED,ED,ED,,Immediate ED evaluation,,"",,Yes,,"",Nutrition bariatric red flags,"ROW_KEY=NUT_BARI_RED_01|EDReferral","Consider obstruction/ulcer",NUT_BARI_RED
NUT_ED_HIGH_RISK_01,NUTRITION,EATING_DISORDER,High-risk eating disorder medical instability,Nutrition,Eating disorder,Electrolyte/cardiac risk,High,Syncope/palpitations/seizure or severe restriction,Y,"Syncope, chest pain/palpitations, seizure, severe weakness",,Purging/restriction,Bradycardia possible,,"",ED,Medical instability risk,ED,ED,ED,,Immediate ED evaluation,,"",,Yes,,"",Nutrition ED red flags,"ROW_KEY=NUT_ED_HIGH_RISK_01|EDReferral","Safety first",NUT_ED_HIGH
NUT_ED_OUTPT_01,NUTRITION,EATING_DISORDER,Eating disorder concern (outpatient),Nutrition,Eating disorder,Behavioral health,Moderate,Disordered eating without instability,N,,,"Purging? restriction?",Normal,,"",PC/UC,Needs coordinated care,PC,,"UC if worsening",PC,Referral to therapy/nutrition,"",,Supportive,No,,"",Nutrition ED cluster,"ROW_KEY=NUT_ED_OUTPT_01|ClinicianEval","Screen suicidality",NUT_ED_OUTPT
