CC_ID,VERSION,Q_ID,ASK_ORDER,QUESTION_TEXT,ANSWER_TYPE,REQUIRED,ASK_IF,CATEGORY
sore_throat,v1,Q_SORE_THROAT_FEVER,10,Do you have fever?,yesno,true,,core
sore_throat,v1,Q_SORE_THROAT_COUGH,20,Do you have cough?,yesno,true,,core
sore_throat,v1,Q_SORE_THROAT_TENDER_ANT_CERVICAL,30,Do you have tender anterior cervical nodes?,yesno,true,,core
sore_throat,v1,Q_SORE_THROAT_STRIDOR,40,Do you have stridor or noisy breathing?,yesno,true,,core
sore_throat,v1,Q_SORE_THROAT_DEHYDRATION,50,Does the patient have dehydration?,yesno,true,,followup
sore_throat,v1,Q_SORE_THROAT_SEVERE_PAIN,60,Does the patient have severe pain?,yesno,true,,followup
